[
  {
    "site": {
      "id": "taoyuan-logistics",
      "code": "TXG-06",
      "name": "Taichung Logistics",
      "nameZhTw": "台中物流站",
      "city": "Taichung",
      "country": "Taiwan",
      "region": "Asia Pacific",
      "timezone": "Asia/Taipei",
      "siteType": "Logistics hub",
      "status": "critical",
      "owner": {
        "name": "Yi-Ting Hsu",
        "team": "Facilities operations"
      }
    },
    "summary": {
      "headline": "Reserve capacity recovery",
      "headlineZhTw": "備轉容量恢復",
      "currentPosture": "Immediate system review required",
      "nextAction": "Hold aggressive charger discharge until inverter review closes.",
      "openAlarmCount": 4,
      "lastUpdated": "3m ago"
    },
    "energyProfile": {
      "siteEuiKbtuFt2Yr": 74.2,
      "sourceEuiKbtuFt2Yr": 161.3,
      "annualEmissionsTco2e": 1218.4,
      "avoidedEmissionsTco2e": 93.7,
      "actualDemandKw": 984,
      "forecastDemandKw": 1036,
      "peakDemandKw": 1180,
      "peakWindow": "15:00-17:00",
      "loadFactorPct": 73.4,
      "actualGenerationKw": 301,
      "forecastGenerationKw": 338,
      "forecastConfidencePct": 82,
      "forecastErrorPct": 5.7,
      "forecastBiasPct": -2.1,
      "loadTrend24h": [
        { "hour": "06:00", "actualKw": 612, "forecastKw": 640 },
        { "hour": "10:00", "actualKw": 901, "forecastKw": 880 },
        { "hour": "14:00", "actualKw": 984, "forecastKw": 1036 },
        { "hour": "18:00", "actualKw": 874, "forecastKw": 910 },
        { "hour": "22:00", "actualKw": 654, "forecastKw": 680 }
      ],
      "generationTrend24h": [
        { "hour": "06:00", "actualKw": 42, "forecastKw": 40 },
        { "hour": "10:00", "actualKw": 224, "forecastKw": 248 },
        { "hour": "14:00", "actualKw": 301, "forecastKw": 338 },
        { "hour": "18:00", "actualKw": 119, "forecastKw": 132 },
        { "hour": "22:00", "actualKw": 0, "forecastKw": 0 }
      ]
    },
    "assets": {
      "hvac": {
        "status": "Warning",
        "onlineUnits": 41,
        "totalUnits": 64,
        "setpointDriftC": 1.7,
        "runtimeHours24h": 19.4,
        "sensorTrend24h": [
          { "hour": "06:00", "zoneTempC": 23.8, "setpointC": 22.5, "runtimePct": 71 },
          { "hour": "10:00", "zoneTempC": 24.4, "setpointC": 22.5, "runtimePct": 84 },
          { "hour": "14:00", "zoneTempC": 25.1, "setpointC": 22.5, "runtimePct": 91 },
          { "hour": "18:00", "zoneTempC": 24.7, "setpointC": 22.5, "runtimePct": 88 },
          { "hour": "22:00", "zoneTempC": 23.6, "setpointC": 22.5, "runtimePct": 69 }
        ]
      },
      "storage": {
        "stateOfChargePct": 38,
        "stateOfHealthPct": 91,
        "availablePowerKw": 460,
        "availableEnergyKwh": 1320,
        "reserveMarginPct": 8,
        "roundTripEfficiencyPct": 88.4,
        "cycles30d": 42
      },
      "generation": {
        "actualKw": 301,
        "forecastKw": 338,
        "capacityFactorPct": 26.8,
        "curtailmentRiskLevel": "watch"
      },
      "chargers": {
        "activeChargers": 14,
        "connectedFleetCount": 22,
        "v2gAvailableKw": 260,
        "utilizationPct": 81,
        "businessModeRecommendation": "Protect reserve before commercial export."
      },
      "mobileChargers": [
        {
          "unitId": "MC-12",
          "status": "redeploying",
          "destination": "Taoyuan North Yard",
          "etaMinutes": 48,
          "priority": "high"
        },
        {
          "unitId": "MC-18",
          "status": "ready",
          "destination": "Taichung Logistics",
          "etaMinutes": 0,
          "priority": "medium"
        }
      ],
      "inventory": {
        "tradableInventoryMwh": 1.2,
        "reservedInventoryMwh": 2.7,
        "releaseThresholdMwh": 1.8,
        "settlementStatus": "Hold",
        "holdReason": "Reserve bank below release threshold."
      },
      "storageTrend24h": [
        { "hour": "06:00", "socPct": 54, "reserveFloorPct": 24 },
        { "hour": "10:00", "socPct": 49, "reserveFloorPct": 24 },
        { "hour": "14:00", "socPct": 38, "reserveFloorPct": 30 },
        { "hour": "18:00", "socPct": 41, "reserveFloorPct": 30 },
        { "hour": "22:00", "socPct": 46, "reserveFloorPct": 24 }
      ],
      "exportPlan": [
        { "window": "16:00", "plannedKw": 180, "availableKw": 96 },
        { "window": "17:00", "plannedKw": 220, "availableKw": 104 },
        { "window": "18:00", "plannedKw": 160, "availableKw": 112 }
      ]
    },
    "modules": [
      {
        "moduleKey": "consumption-forecasting-optimization",
        "name": "Consumption Forecasting & Optimization",
        "nameZhTw": "用電預測與優化",
        "currentPosture": "Demand response needs intervention",
        "forecast": "The next demand window is still above the preferred reserve-backed band.",
        "risk": "Demand overrun risk elevated",
        "recommendedAction": "Prioritize reserve recovery before the evening peak window.",
        "owner": "Facilities operations",
        "cadence": "30-minute demand plan",
        "metrics": {
          "actualDemandKw": 984,
          "forecastDemandKw": 1036,
          "peakDemandKw": 1180,
          "expectedSavingsUsd": 214,
          "demandResponseReady": false
        }
      },
      {
        "moduleKey": "bidirectional-charger-operations",
        "name": "Bidirectional Charger Operations",
        "nameZhTw": "雙向充電樁",
        "currentPosture": "Reserve bank is constrained",
        "forecast": "Bidirectional output remains below the release threshold.",
        "risk": "Reserve shortfall risk",
        "recommendedAction": "Hold aggressive discharge until inverter review clears.",
        "owner": "Fleet operations",
        "cadence": "Hourly reserve posture",
        "metrics": {
          "activeChargers": 14,
          "connectedFleetCount": 22,
          "v2gAvailableKw": 260,
          "reserveMarginPct": 8,
          "utilizationPct": 81
        }
      },
      {
        "moduleKey": "energy-resource-commercial-inventory",
        "name": "Energy Resource Commercial Inventory",
        "nameZhTw": "能源資源商品化庫存管理",
        "currentPosture": "Inventory release is restricted",
        "forecast": "Commercial inventory cannot fully support the current plan.",
        "risk": "Commercial hold is active",
        "recommendedAction": "Escalate release decision with market operations.",
        "owner": "Commercial inventory desk",
        "cadence": "Daily inventory release",
        "metrics": {
          "tradableInventoryMwh": 1.2,
          "reservedInventoryMwh": 2.7,
          "releaseThresholdMwh": 1.8,
          "settlementStatus": "Hold"
        }
      }
    ],
    "alerts": [
      {
        "id": "ALT-201",
        "severity": "critical",
        "title": "Inverter review blocking reserve release",
        "titleZhTw": "逆變器檢查阻塞備轉釋放",
        "owner": "Yi-Ting Hsu",
        "moduleKey": "bidirectional-charger-operations",
        "openedAgo": "19m",
        "dueWindow": "Before 17:00 dispatch lock",
        "status": "open"
      },
      {
        "id": "ALT-202",
        "severity": "watch",
        "title": "Peak load window forecast widened",
        "titleZhTw": "尖峰負載預測區間擴大",
        "owner": "Energy desk",
        "moduleKey": "consumption-forecasting-optimization",
        "openedAgo": "33m",
        "dueWindow": "Next demand plan refresh",
        "status": "open"
      }
    ],
    "reports": [
      {
        "id": "daily-ops-brief",
        "type": "daily",
        "title": "Daily operations brief",
        "titleZhTw": "每日營運簡報",
        "status": "attention",
        "updated": "9m ago",
        "purpose": "Handoff alarms, HVAC exceptions, EMS posture, and the next operator decision before evening dispatch.",
        "includes": [
          "Alarm count and exception ownership",
          "HVAC and EMS posture summary",
          "Next operator checkpoint"
        ],
        "decisionCue": "Can the site safely clear the next reserve-backed dispatch window?"
      },
      {
        "id": "settlement-packet",
        "type": "settlement",
        "title": "Settlement and commercial packet",
        "titleZhTw": "結算與商務封包",
        "status": "draft",
        "updated": "27m ago",
        "purpose": "Clarify export posture, reserve-backed inventory release, and settlement readiness.",
        "includes": [
          "Export and revenue posture",
          "Inventory release conditions",
          "Required settlement documents"
        ],
        "decisionCue": "Should inventory remain on hold through the current market window?"
      }
    ],
    "visualizations": [
      {
        "id": "devices-load-trend-24h",
        "type": "line-actual-vs-forecast",
        "title": "24h load trend",
        "dataKey": "energyProfile.loadTrend24h",
        "tab": "devices"
      },
      {
        "id": "ems-soc-reserve-band",
        "type": "line-with-band",
        "title": "Storage SOC and reserve band",
        "dataKey": "assets.storageTrend24h",
        "tab": "ems"
      },
      {
        "id": "ems-export-plan",
        "type": "bar-planned-vs-available",
        "title": "Export plan vs available",
        "dataKey": "assets.exportPlan",
        "tab": "ems"
      }
    ]
  },
  {
    "site": {
      "id": "taoyuan-hub",
      "code": "TPE-02",
      "name": "Taipei Hub",
      "nameZhTw": "台北樞紐站",
      "city": "Taipei",
      "country": "Taiwan",
      "region": "Asia Pacific",
      "timezone": "Asia/Taipei",
      "siteType": "Urban operations hub",
      "status": "watch",
      "owner": {
        "name": "Chia-Hao Lin",
        "team": "Facilities operations"
      }
    },
    "summary": {
      "headline": "HVAC fault isolation",
      "headlineZhTw": "HVAC 異常隔離",
      "currentPosture": "One operating signal needs review",
      "nextAction": "Inspect the delayed meter stream before the next EMS planning cycle.",
      "openAlarmCount": 3,
      "lastUpdated": "9m ago"
    },